{
  "schema_version": 1,
  "name": "inkling-small-mtp",
  "description": "Exact official eight-layer multi-layer EAGLE 8-1-9 candidate; separately qualified.",
  "model_path": "/models/Inkling-Small-NVFP4",
  "server_executable": ["sglang", "serve"],
  "base_args": [
    "--trust-remote-code",
    "--model-type", "llm",
    "--model-path", "/models/Inkling-Small-NVFP4",
    "--served-model-name", "inkling-small-nvfp4",
    "--model-impl", "sglang",
    "--tp", "2",
    "--nnodes", "2",
    "--quantization", "modelopt_fp4",
    "--kv-cache-dtype", "bfloat16",
    "--attention-backend", "triton",
    "--page-size", "128",
    "--fp4-gemm-backend", "flashinfer_trtllm",
    "--moe-runner-backend", "flashinfer_cutlass",
    "--disable-flashinfer-autotune",
    "--mamba-radix-cache-strategy", "extra_buffer",
    "--enable-multi-layer-eagle",
    "--swa-full-tokens-ratio", "0.1",
    "--mamba-full-memory-ratio", "0.1",
    "--enable-multimodal",
    "--reasoning-parser", "inkling",
    "--tool-call-parser", "inkling",
    "--random-seed", "0",
    "--cuda-graph-backend-decode", "disabled",
    "--cuda-graph-backend-prefill", "disabled"
  ],
  "defaults": {
    "context_length": 32768,
    "concurrency": 1,
    "kv_dtype": "bf16",
    "chunk_size": 1024,
    "graph_max_decode_batch": 1
  },
  "mtp": {
    "layers": 8,
    "draft_layers": 1,
    "total_layers": 9
  },
  "mem_fraction_static": 0.85,
  "runtime_mode": "native-cuda13-arm64-sm121"
}
